,Tweets,clean_tweet,polarity,subjectivity,,Product,,,
27-04-2020 09:21,b'@nokia @NokiaNAM @USCellular @NokiaMobile Thank you',Thank,0,0,,0,,,
27-04-2020 07:28,b'@retajalfaisal @NokiaNAM @USCellular Hi! For all phone-related matters please head over to @NokiaMobile. As the hom\xe2\x80\xa6 https://t.co/XcnYB9ODus',phone related matters please head over https XcnYB ODus,0,0,,0,,,
27-04-2020 04:02,b'@voxdotcom @USCellular The internet has been *extremely* productive relative to the flow of the historical river.\xe2\x80\xa6 https://t.co/CzDZo4uPAF',internet been extremely productive relative flow historical river https CzDZo uPAF,0.285714286,0.535714286,,0.153061224,,,
27-04-2020 02:35,b'Damn i really wish @USCellular would stop slowing down my upload and download speeds. I call you guys every month!',Damn really wish would stop slowing down upload download speeds call guys every month,0,0,,0,,,
27-04-2020 02:00,b'@USCellular : \xe2\x80\x9cKeeping you connect is our commitment. Use all the data you want free of charge. We know times are r\xe2\x80\xa6 https://t.co/wTPqaOpNs0',cKeeping connect commitment data want free charge know times https wTPqaOpNs,0,0,,0,,,
28-04-2020 03:53,b'My phone is on silent... Yet the annoying @USCellular sound comes blaring out all of a sudden when it reboots itsel\xe2\x80\xa6 https://t.co/DzKjkk5gSd',phone silent annoying sound comes blaring sudden when reboots itsel https DzKjkk,0,0,,0,,,
28-04-2020 01:39,b'RT @bruns_marcella1: How does it take over 9 hours to fix a cut wire? @USCellular',does take over hours wire,0.5,0.5,,0.25,,,
28-04-2020 01:38,b'RT @bruns_marcella1: How does it take over 9 hours to fix a cut wire? @USCellular',does take over hours wire,0,0,,0,,,
28-04-2020 01:37,b'How does it take over 9 hours to fix a cut wire? @USCellular',does take over hours wire,0.2,0.2,,0.04,,,
28-04-2020 00:42,b'@USCellularCares @USCellular I mentioned it to the rep who helped us this evening. Thank you.',mentioned helped this evening Thank,0,0,,0,,,
27-04-2020 23:52,"b""@WmScottBlair I'm glad to hear that! If you don't mind, I'd also like to share your feedback with her. Please DM yo\xe2\x80\xa6 https://t.co/8g5AePRDlU""",glad hear that mind also like share your feedback with Please https AePRDlU,0,0,,0,,,
27-04-2020 20:53,"b'.@Nokia, @USCellular team to combat COVID-19 malware | @Light_Reading https://t.co/ttWWx1CNtd'",team combat COVID malware https ttWWx CNtd,0,0,,0,,,
27-04-2020 20:26,b'@USCellular temporarily closed their location next door to my clinic...\nOne of their cell phone alarms is going off\xe2\x80\xa6 https://t.co/8rXi4YmNfK',temporarily closed their location next door clinic nOne their cell phone alarms going https YmNfK,0,0,,0,,,
27-04-2020 19:37,"b'RT @DBP_News: DBP member @USCellular, with Ericsson support, recently began boosting mobile broadband capacity to customers to help keep th\xe2\x80\xa6'",member with Ericsson support recently began boosting mobile broadband capacity customers help keep,0,0,,0,,,
27-04-2020 11:46,"b'@USCellular Why is it such a pain to log in to your website?\nFor starters, there is no login button on your main pa\xe2\x80\xa6 https://t.co/s6cBvrFHFH'",such pain your website nFor starters there login button your main https cBvrFHFH,-0.65625,0.84375,,-0.553710938,,,
01-05-2020 04:34,"b'@USCellular My phone service just dropped from full signal to 1 bar. I cannot use data, and phone calls are cut off\xe2\x80\xa6 https://t.co/bQW2MQYyU7'",phone service just dropped from full signal cannot data phone calls https MQYyU,0.666666667,0.466666667,,0.311111111,,,
01-05-2020 02:04,"b'RT @BehindBadgers: WHO DAT?! The newest member of the @Saints, our guy @zackbizzaun joins the pod to talk draft &amp; more! \n\nBehind the Badger\xe2\x80\xa6'",newest member joins talk draft more nBehind Badger,0,0,,0,,,
01-05-2020 00:03,"b'RT @BehindBadgers: WHO DAT?! The newest member of the @Saints, our guy @zackbizzaun joins the pod to talk draft &amp; more! \n\nBehind the Badger\xe2\x80\xa6'",newest member joins talk draft more nBehind Badger,0,0,,0,,,
30-04-2020 22:12,"b'RT @BehindBadgers: WHO DAT?! The newest member of the @Saints, our guy @zackbizzaun joins the pod to talk draft &amp; more! \n\nBehind the Badger\xe2\x80\xa6'",newest member joins talk draft more nBehind Badger,0,0,,0,,,
30-04-2020 21:43,"b'RT @BehindBadgers: WHO DAT?! The newest member of the @Saints, our guy @zackbizzaun joins the pod to talk draft &amp; more! \n\nBehind the Badger\xe2\x80\xa6'",newest member joins talk draft more nBehind Badger,-0.166666667,0.433333333,,-0.072222222,,,
30-04-2020 21:42,"b'RT @BehindBadgers: WHO DAT?! The newest member of the @Saints, our guy @zackbizzaun joins the pod to talk draft &amp; more! \n\nBehind the Badger\xe2\x80\xa6'",newest member joins talk draft more nBehind Badger,0.325,0.658333333,,0.213958333,,,
30-04-2020 21:42,"b'WHO DAT?! The newest member of the @Saints, our guy @zackbizzaun joins the pod to talk draft &amp; more! \n\nBehind the B\xe2\x80\xa6 https://t.co/XXhf2fNfhK'",newest member joins talk draft more nBehind https XXhf fNfhK,0,0,,0,,,
30-04-2020 20:30,"b""Unprecedented times call for unprecedented measures. We've helped @USCellular add additional capacity to more than\xe2\x80\xa6 https://t.co/9ufeeSHSe1""",Unprecedented times call unprecedented measures helped additional capacity more than https ufeeSHSe,0,0.3,,0,,,
30-04-2020 16:28,"b""While we're all busy navigating through these unprecedented times, wireless companies are working to help keep Amer\xe2\x80\xa6 https://t.co/fPu8ATPccg""",While busy navigating through these unprecedented times wireless companies working help keep Amer https ATPccg,-0.5,1,,-0.5,,,
30-04-2020 15:48,"b'@verge @USCellular THE----   "" SUPREME COURT-- "" NEEDS TO \n--- RULE---- ON THE  """" ILLEGAL """" BEHAVIOR \nON THE MSM-\xe2\x80\xa6 https://t.co/qW9jceRKY7'",SUPREME COURT NEEDS RULE ILLEGAL BEHAVIOR https jceRKY,-0.5,1,,-0.5,,,
30-04-2020 07:52,b'RT @NokiaNAM: Keeping our customers connected is important now more than ever. We are proud to be collaborating with @USCellular to deploy\xe2\x80\xa6',Keeping customers connected important more than ever proud collaborating with deploy,0,0,,0,,,
30-04-2020 03:35,b'@USCellularCares @USCellular Still have not**',Still have,0,0,,0,,,
30-04-2020 03:18,b'Searching for the positive. I really do have a fantastic employer. Shout-out to @USCellular for taking care of thei\xe2\x80\xa6 https://t.co/v3rik2TmV6',Searching positive really have fantastic employer Shout taking care thei https,0.285714286,0.535714286,,0.153061224,,,
30-04-2020 02:29,b'@USCellularCares @USCellular I replied with a DM 3.5 hours ago &amp; still have recieved any kind of response.',replied with hours still have recieved kind response,0,0,,0,,,
30-04-2020 01:45,b'@USCellularCares @USCellular You are way nicer tht ^JD',nicer,0.5,0.5,,0.25,,,
30-04-2020 01:44,b'@eihcirekalb Technicians are working to restore service as quickly as possible. Please DM your phone number to\xe2\x80\xa6 https://t.co/jsuOgWeIMQ',Technicians working restore service quickly possible Please your phone number https jsuOgWeIMQ,0,0,,0,,,
30-04-2020 01:22,b'@USCellular Or you could just fix it\xf0\x9f\xa4\xb7\xf0\x9f\x8f\xbb\xe2\x80\x8d\xe2\x99\x82\xef\xb8\x8f',could just,0,0,,0,,,
29-04-2020 23:08,b'@katandmouseduh Hi there! I apologize you have not been contacted yet. Please DM your phone number to @uscellular f\xe2\x80\xa6 https://t.co/DM4XkEcs30',there apologize have been contacted Please your phone number https XkEcs,0,0,,0,,,
29-04-2020 23:05,b'Hey @USCellular I scheduled an online apt for device support today &amp; have been put on call lists multiple times and\xe2\x80\xa6 https://t.co/ZawncCRwSN',scheduled online device support today have been call lists multiple times https ZawncCRwSN,0,0,,0,,,
29-04-2020 22:16,b'@USCellular Only 30 ppl\xf0\x9f\x98\x82',Only,0,0,,0,,,
29-04-2020 22:08,b'@USCellular I have tried restarting it. Still nothing',have tried restarting Still nothing,0,0,,0,,,
29-04-2020 22:04,"b'@USCellular It\xe2\x80\x99s not my phone it\xe2\x80\x99s your service, fix it https://t.co/vuhUNz8JM4'",phone your service https vuhUNz,0,0,,0,,,
29-04-2020 21:55,b'@USCellular any idea when you will have service back in the maquoketa iowa area??? I\xe2\x80\x99m in college and have been wit\xe2\x80\xa6 https://t.co/u2VShuph9M',idea when will have service back maquoketa iowa area college have been https VShuph,-0.166666667,0.433333333,,-0.072222222,,,
29-04-2020 21:43,b'@USCellular No had phone for a while now',phone while,0,0,,0,,,
29-04-2020 21:30,b'@USCellular Dropping calls like crazy today and just bad coverage. Yes.',Dropping calls like crazy today just coverage,0,0,,0,,,
29-04-2020 21:21,b'Why can\xe2\x80\x99t @USCellular ever provide consistent service? You guys are terrible',ever provide consistent service guys terrible,0.6,0.7,,0.42,,,
29-04-2020 18:59,b'@USCellularCares @USCellular Done. Thanks.',Done Thanks,0.5,1,,0.5,,,
29-04-2020 18:58,b'@craigharoldson This is not the service experience that we want for you to have with us today Craig. Can you please\xe2\x80\xa6 https://t.co/2PBK0Ezndc',This service experience that want have with today Craig please https Ezndc,0.1,0.4,,0.04,,,
29-04-2020 18:50,b'The one thing I would love to see from @USCellular in 2020:  to be able to self activate devices through the websit\xe2\x80\xa6 https://t.co/cGgN9Rzp2s',thing would love from able self activate devices through websit https cGgN,0.175,0.375,,0.065625,,,
29-04-2020 16:23,b'Many Americans choose to seek the safety of their own homes during the COVID-19 pandemic. @USCellular offers enjoya\xe2\x80\xa6 https://t.co/2ZbgtN4kfg',Many Americans choose seek safety their homes during COVID pandemic offers enjoya https ZbgtN,0,0,,0,,,
29-04-2020 16:14,b'@USCellular Honestly no you guys will not!',Honestly guys will,0.1,0.4,,0.04,,,
29-04-2020 16:08,b'@USCellular Definitely calling to cancel today thank you',Definitely calling cancel today thank,0.175,0.375,,0.065625,,,
29-04-2020 15:56,b'@USCellular It\xe2\x80\x99s hard to explain and at this point I\xe2\x80\x99m looking at different carriers.',hard explain this point looking different carriers,0,0,,0,,,
29-04-2020 15:46,b'@USCellular \xf0\x9f\x98\x82\xf0\x9f\x98\x82\xf0\x9f\x98\x82\xf0\x9f\x98\x82 that\xe2\x80\x99s what you guys always say. But you guys made me pull my mom out during quarantine just to ge\xe2\x80\xa6 https://t.co/xQ1w4A2tzZ',that what guys always guys made pull during quarantine just https,0,0,,0,,,
29-04-2020 15:26,b'During this pandemic @USCellular has some of the most rudest employees I have ever met before in my life. I just don\xe2\x80\x99t get it at all!',During this pandemic some most rudest employees have ever before life just,0.666666667,0.466666667,,0.311111111,,,
29-04-2020 14:38,b'@USCellular what is up with your network today here in Waunakee. I can\xe2\x80\x99t have a call last for two minutes without i\xe2\x80\xa6 https://t.co/Vft1VQdTjm',what with your network today here Waunakee have call last minutes without https VQdTjm,0,0,,0,,,
29-04-2020 14:13,"b""@USCellular I dont recall what day it was, days are all blended together right now. All I know is I was told I'd be\xe2\x80\xa6 https://t.co/XR3KUX0kll""",dont recall what days blended together right know told https,0,0,,0,,,
29-04-2020 14:08,b'@USCellular Your \xe2\x80\x9cforgot\xe2\x80\x9d page is missing a very important apostrophe. Singular possessive is where it\xe2\x80\x99s about. https://t.co/5BskkKIf0P',Your cforgot page missing very important apostrophe Singular possessive where about https BskkKIf,0,0,,0,,,
29-04-2020 04:18,b'Thanks @USCellular for somehow ignoring my concern about me being late with my cell bill until thursday n shutting\xe2\x80\xa6 https://t.co/2HVrG12zsg',Thanks somehow ignoring concern about being late with cell bill until thursday shutting https HVrG,-0.166666667,0.433333333,,-0.072222222,,,
29-04-2020 03:50,b'@USCellular why do I keep getting notifications from this and especially when I go to charge my phone? After around\xe2\x80\xa6 https://t.co/mofnMiRU9c',keep getting notifications from this especially when charge phone After around https mofnMiRU,0.325,0.658333333,,0.213958333,,,
29-04-2020 02:56,"b'RT @USCellular: Nervous about leaving your parents\xe2\x80\x99 phone plan? Don\xe2\x80\x99t worry, we\xe2\x80\x99ve got your back, including $400 back in your pocket when y\xe2\x80\xa6'",Nervous about leaving your parents phone plan worry your back including back your pocket when,0,0,,0,,,
29-04-2020 02:09,b'@TJalean @USCellular Well atleast it is coming and you got a credit for crying lmao you know our phone is our babies',Well atleast coming credit crying lmao know phone babies,0,0.3,,0,,,
29-04-2020 01:36,"b'@FineAssNessy @USCellular But at least they emailed me, and credited $14.99 \xf0\x9f\xa4\xa6\xf0\x9f\x8f\xbd\xe2\x80\x8d\xe2\x99\x80\xef\xb8\x8f but I have to wait a week for my\xe2\x80\xa6 https://t.co/XAkX3LV3jr'",least they emailed credited have wait week https XAkX,-0.5,1,,-0.5,,,
29-04-2020 01:07,b'@USCellularCares @USCellular I did an online chat. I got help',online chat help,-0.5,1,,-0.5,,,
29-04-2020 01:06,b'@FineAssNessy @USCellular I\xe2\x80\x99m so mad',,0,0,,0,,,
29-04-2020 01:05,b'@TJalean @USCellular They some bs fr I have them to smh',They some have them,0.1,0.4,,0.04,,,
29-04-2020 01:05,b'@AgentApplebutt3 @USCellularCares @USCellular I can see \xf0\x9f\x98\x8a',,0.175,0.375,,0.065625,,,
29-04-2020 00:57,b'@AgentApplebutt3 I apologize if you missed our last reply. Please DM your phone number to @uscellular. ^KJ',apologize missed last reply Please your phone number,0,0,,0,,,
29-04-2020 00:51,b'@USCellularCares @USCellular I cannot call you whatsoever. My cell and data is completely out. Fix this or answer m\xe2\x80\xa6 https://t.co/gDsTlwfxX7',cannot call whatsoever cell data completely this answer https gDsTlwfxX,0,0,,0,,,
29-04-2020 00:36,b'@USCellular I just emailed you',just emailed,0.666666667,0.466666667,,0.311111111,,,
29-04-2020 00:33,"b'@USCellular Hey!! I can\xe2\x80\x99t call you to report an outage. You say you have no problems, BS I\xe2\x80\x99m down and so is my neig\xe2\x80\xa6 https://t.co/3QRILxOpfo'",call report outage have problems down neig https QRILxOpfo,0,0,,0,,,
29-04-2020 00:27,b'@USCellular My cell service just quit. Do you have an outrage? https://t.co/xjKVD7g0Qy',cell service just quit have outrage https xjKVD,0,0,,0,,,
29-04-2020 00:13,"b'@USCellular Until next week, and my mom is so upset!'",Until next week upset,0,0,,0,,,
29-04-2020 00:12,b'@USCellular My phone is in transit back to you guys and my mom verified it to be purchased. I have to wait now for\xe2\x80\xa6 https://t.co/uECSztsfyR',phone transit back guys verified purchased have wait https uECSztsfyR,-0.166666667,0.433333333,,-0.072222222,,,
03-05-2020 06:05,"b'@USCellular LIAR LIAR pants on fire.Oh we wont turn off you service. We wont do that. LIAR!We got turned off.We,1st\xe2\x80\xa6 https://t.co/hl2xveufp1'",LIAR LIAR pants fire wont turn service wont that LIAR turned https xveufp,0.325,0.658333333,,0.213958333,,,
03-05-2020 03:38,b'Thank you @USCellular for providing us with a movie night!',Thank providing with movie night,0,0,,0,,,
03-05-2020 00:18,b'Smh @USCellular your service in eastern Washington is garbage. @Verizon hook it up fam',your service eastern Washington garbage hook,0,0.3,,0,,,
02-05-2020 05:00,"b""@JennyBlighe I think I can figure it out. @MissLollipopMFC  got me to sign up for MFC but I'm not premium yet. I ca\xe2\x80\xa6 https://t.co/CMndhStq3O""",think figure sign premium https CMndhStq,-0.5,1,,-0.5,,,
02-05-2020 04:39,"b'RT @BehindBadgers: WHO DAT?! The newest member of the @Saints, our guy @zackbizzaun joins the pod to talk draft &amp; more! \n\nBehind the Badger\xe2\x80\xa6'",newest member joins talk draft more nBehind Badger,-0.5,1,,-0.5,,,
02-05-2020 02:42,"b""@USCellular Hi, I'm from Iran, I have an HTC Touch Pro 2, which has very poor internet and antenna performance, and\xe2\x80\xa6 https://t.co/DQwY2iSh6M""",from Iran have Touch which very poor internet antenna performance https DQwY,0,0,,0,,,
02-05-2020 01:57,b'@USCellular It\xe2\x80\x99s hard to explain lol there\xe2\x80\x99s a lady in a different town we don\xe2\x80\x99t know that says her phone rings whe\xe2\x80\xa6 https://t.co/yrjRwSJvgI',hard explain there lady different town know that says phone rings https yrjRwSJvgI,0,0,,0,,,
02-05-2020 01:56,"b'@USCellular No when I call my daughters number, a random lady we don\xe2\x80\x99t know answers and she said she just got that\xe2\x80\xa6 https://t.co/rRIwaoInHL'",when call daughters number random lady know answers said just that https rRIwaoInHL,0,0,,0,,,
02-05-2020 01:52,b'@USCellular I will double check and make sure the numbers are the same. If they aren\xe2\x80\x99t the lines are crossed and me\xe2\x80\xa6 https://t.co/t5qe3XO3Nr',will double check make sure numbers same they aren lines crossed https,0,0,,0,,,
02-05-2020 01:50,b'@USCellular It\xe2\x80\x99s a regular account and I\xe2\x80\x99ve called the number and she said she just got the phone last week and it\xe2\x80\x99\xe2\x80\xa6 https://t.co/Bi5E20fEev',regular account called number said just phone last week https fEev,0,0,,0,,,
02-05-2020 01:38,b'@USCellular Umm you guys gave my daughters active phone number to another person and now my daughters phone doesn\xe2\x80\x99t\xe2\x80\xa6 https://t.co/Jzf5k7qs85',guys gave daughters active phone number another person daughters phone doesn https,0,0,,0,,,
05-05-2020 13:13,"b'RT @verge: How the Supreme Court is trying cases.\n\nLearn about this and more in our Fairness, Defined hub. @USCellular #ad'",Supreme Court trying cases nLearn about this more Fairness Defined,0,0,,0,,,
05-05-2020 13:13,b'RT @iHeartMediaMKE: Addition artists announced for the @USCellular Connection Stage @Summerfest... @lifehouse with @957bigfm 6/29; @filmore\xe2\x80\xa6',Addition artists announced Connection Stage with,0,0,,0,,,
05-05-2020 12:45,b'@awcgreenville are notorious for being an innovative @USCellular agent. Listen to how they used Statflo to drive 4\xe2\x80\xa6 https://t.co/Z13IDFUvnq',notorious being innovative agent Listen they used Statflo drive https IDFUvnq,-0.166666667,0.433333333,,-0.072222222,,,
05-05-2020 01:18,b'@USCellular keeping people on hold for 30 minutes to pay their bill.\n People who are blessed enough to pay their bi\xe2\x80\xa6 https://t.co/Y02briNAhi',keeping people hold minutes their bill People blessed enough their https briNAhi,0,0,,0,,,
05-05-2020 00:00,b'@USCellular I am not a US Cellular member. I just ordered as a guest.',Cellular member just ordered guest,0,0,,0,,,
04-05-2020 23:39,b'@USCellular I ordered as anonymous',ordered anonymous,0.6,0.7,,0.42,,,
04-05-2020 22:11,b'RT @jeffkagan: US Cellular delivers a strong Q1 https://t.co/5JkpVJj1xP via @rcrwirelessnews @uscellular',Cellular delivers strong https JkpVJj,0.5,1,,0.5,,,
04-05-2020 21:47,b'US Cellular delivers a strong Q1 https://t.co/5JkpVJj1xP via @rcrwirelessnews @uscellular',Cellular delivers strong https JkpVJj,0.1,0.4,,0.04,,,
04-05-2020 21:04,"b'RT @UWBadgers: Together, along with our partners, we want to thank all of the the frontline workers for their courage in helping our commun\xe2\x80\xa6'",Together along with partners want thank frontline workers their courage helping commun,0.175,0.375,,0.065625,,,
04-05-2020 20:10,b'So after being with @USCellular for a week now tomorrow and dropping @Verizon I\xe2\x80\x99m so happy! We should have switched\xe2\x80\xa6 https://t.co/cbrr1SCxMj',after being with week tomorrow dropping happy should have switched https cbrr SCxMj,0,0,,0,,,
04-05-2020 18:46,"b'RT @UWBadgers: Together, along with our partners, we want to thank all of the the frontline workers for their courage in helping our commun\xe2\x80\xa6'",Together along with partners want thank frontline workers their courage helping commun,-0.077777778,0.394444444,,-0.030679012,,,
04-05-2020 18:42,"b'RT @UWBadgers: Together, along with our partners, we want to thank all of the the frontline workers for their courage in helping our commun\xe2\x80\xa6'",Together along with partners want thank frontline workers their courage helping commun,0,0,,0,,,
04-05-2020 18:41,b'@USCellular Yes it is extremely odd! The last phone my daughter had is here at our house so that\xe2\x80\x99s even more strang\xe2\x80\xa6 https://t.co/CMhAAAngVb',extremely last phone daughter here house that even more strang https CMhAAAngVb,0,0,,0,,,
04-05-2020 17:13,"b'RT @UWBadgers: Together, along with our partners, we want to thank all of the the frontline workers for their courage in helping our commun\xe2\x80\xa6'",Together along with partners want thank frontline workers their courage helping commun,0,0,,0,,,
04-05-2020 17:08,"b'RT @UWBadgers: Together, along with our partners, we want to thank all of the the frontline workers for their courage in helping our commun\xe2\x80\xa6'",Together along with partners want thank frontline workers their courage helping commun,0,0,,0,,,
04-05-2020 17:05,"b'RT @UWBadgers: Together, along with our partners, we want to thank all of the the frontline workers for their courage in helping our commun\xe2\x80\xa6'",Together along with partners want thank frontline workers their courage helping commun,0,0,,0,,,
04-05-2020 17:01,"b'RT @UWBadgers: Together, along with our partners, we want to thank all of the the frontline workers for their courage in helping our commun\xe2\x80\xa6'",Together along with partners want thank frontline workers their courage helping commun,0,0,,0,,,
04-05-2020 17:00,"b'Together, along with our partners, we want to thank all of the the frontline workers for their courage in helping o\xe2\x80\xa6 https://t.co/HRTJJcb6jr'",Together along with partners want thank frontline workers their courage helping https HRTJJcb,0,0,,0,,,
04-05-2020 14:58,b'U.S. Cellular stays on track as profits rise https://t.co/ZSTsnSuqVh @uscellular',Cellular stays track profits rise https ZSTsnSuqVh,0,0,,0,,,
04-05-2020 08:16,b'Check these tips to help your kids be safe online: https://t.co/aHzz0WojqT @USCellular #internetsafety #mobile',Check these tips help your kids safe online https aHzz WojqT internetsafety mobile,-0.166666667,0.433333333,,-0.072222222,,,
04-05-2020 04:53,"b""@USCellular if I ordered some Pixel Buds last Wednesday and I still haven't gotten tracking information, is there a\xe2\x80\xa6 https://t.co/6DUPAvFgYs""",ordered some Pixel Buds last Wednesday still haven gotten tracking information there https DUPAvFgYs,0,0,,0,,,
07-05-2020 06:54,"b""@USCellular you know we heard, you wouldn't shut anyone's service off. Yeah rt.  My husband is a 1st responder and\xe2\x80\xa6 https://t.co/Shu96xN7R5""",know heard wouldn shut anyone service Yeah husband responder https,0,0,,0,,,
07-05-2020 04:50,"b""Phones aren't indestructible. Are you unknowingly putting your device at risk? https://t.co/o3k2jFabPG @USCellular #BloggerBrigade #gadgets""",Phones aren indestructible unknowingly putting your device risk https jFabPG BloggerBrigade gadgets,0.6,0.7,,0.42,,,
06-05-2020 20:26,b'@MRfastANDdanger I truly apologize. Please DM your order number to @uscellular so I can look into this for you. ^KJ',truly apologize Please your order number look into this,0.5,1,,0.5,,,
06-05-2020 19:51,b'@thetestdrivers @austinnotduncan @imyke I got my parents both brand new SE 128GBs.  @USCellular has a promotion whe\xe2\x80\xa6 https://t.co/BjcUv0qVPm',parents both brand promotion https BjcUv qVPm,0.1,0.4,,0.04,,,
06-05-2020 19:18,b'@Brewers @USCellular @ChristianYelich @bruter24 @Kestdaddy Brauny looking hot af again \xf0\x9f\xa5\xb5\xf0\x9f\x98\x8d',Brauny looking again,0,0.25,,0,,,
06-05-2020 19:09,"b'RT @Brewers: Are your Zoom meetings feeling stale? Freshen up your ""home office"" on this #WallpaperWednesday, presented by @USCellular. \n\nA\xe2\x80\xa6'",your Zoom meetings feeling stale Freshen your home office this WallpaperWednesday presented,0,0,,0,,,
06-05-2020 19:04,b'@USCellular This is a lie you cut my connection today.\n\nI have memory deficits due to a brain injury so any website\xe2\x80\xa6 https://t.co/p4hfgikeRh',This connection today have memory deficits brain injury website https hfgikeRh,-0.1,0.1,,-0.01,,,
06-05-2020 18:59,"b'RT @Brewers: Are your Zoom meetings feeling stale? Freshen up your ""home office"" on this #WallpaperWednesday, presented by @USCellular. \n\nA\xe2\x80\xa6'",your Zoom meetings feeling stale Freshen your home office this WallpaperWednesday presented,0,0,,0,,,
06-05-2020 18:57,"b'RT @Brewers: Are your Zoom meetings feeling stale? Freshen up your ""home office"" on this #WallpaperWednesday, presented by @USCellular. \n\nA\xe2\x80\xa6'",your Zoom meetings feeling stale Freshen your home office this WallpaperWednesday presented,0,0,,0,,,
06-05-2020 18:50,b'@ATT like why???? What\xe2\x80\x99s todays date again? Oh yeah...it\xe2\x80\x99s 5/6/20 \xf0\x9f\x99\x84\xf0\x9f\x99\x84\xf0\x9f\x99\x84\xf0\x9f\x99\x84\xf0\x9f\x99\x84\xf0\x9f\x99\x84\xf0\x9f\x99\x84 AND I\xe2\x80\x99M ON WIFI. NOT TO MENTION IT\xe2\x80\x99S A GL\xe2\x80\xa6 https://t.co/shTkwm1qTB',like What todays date again yeah WIFI MENTION https shTkwm,0.25,0.3,,0.075,,,
06-05-2020 18:36,b'@Brewers @USCellular @ChristianYelich @bruter24 @Kestdaddy The third one is the funniest picture out of the four an\xe2\x80\xa6 https://t.co/XNQYUJbMw4',third funniest picture four https XNQYUJbMw,0.25,0.3,,0.075,,,
06-05-2020 18:28,"b'RT @Brewers: Are your Zoom meetings feeling stale? Freshen up your ""home office"" on this #WallpaperWednesday, presented by @USCellular. \n\nA\xe2\x80\xa6'",your Zoom meetings feeling stale Freshen your home office this WallpaperWednesday presented,0.214285714,0.571428571,,0.12244898,,,
