,Tweets,clean_tweet,polarity,subjectivity,,Product,,,
03-03-2020 05:47,"b""@CraigStolt @JohnLegere @BillNye Kid u not. Clicked thru thread to learn more about T-Mobile's 5G. Fascinated that\xe2\x80\xa6 https://t.co/SQvjgzKM3j""",Clicked thru thread learn more about Mobile Fascinated that https SQvjgzKM,0.5,0.5,,0.25,,Sum,47.87446548
03-03-2020 03:37,"b'RT @CF_Booster: GAME ON! Tuesday, March 3 at 8pm in the U.S. Cellular Center, Cedar Rapids. Plan to attend as #tigerpride @CFHSGoTigers @Ce\xe2\x80\xa6'",GAME Tuesday March Cellular Center Cedar Rapids Plan attend tigerpride,-0.25,0.25,,-0.0625,,,
03-03-2020 03:26,"b'GAME ON! Tuesday, March 3 at 8pm in the U.S. Cellular Center, Cedar Rapids. Plan to attend as #tigerpride\xe2\x80\xa6 https://t.co/5F3UUqhbih'",GAME Tuesday March Cellular Center Cedar Rapids Plan attend tigerpride https UUqhbih,-0.25,0.25,,-0.0625,,,
03-03-2020 03:10,b'RT @IgnacioTechie: #5G mmWave delivers unprecedented cellular speeds. With &gt;$11B committed by U.S. operators in recent mmWave spectrum auct\xe2\x80\xa6',mmWave delivers unprecedented cellular speeds With committed operators recent mmWave spectrum auct,0.3,0.575,,0.1725,,,
03-03-2020 03:07,b'RT @IgnacioTechie: #5G mmWave delivers unprecedented cellular speeds. With &gt;$11B committed by U.S. operators in recent mmWave spectrum auct\xe2\x80\xa6',mmWave delivers unprecedented cellular speeds With committed operators recent mmWave spectrum auct,0.3,0.575,,0.1725,,Average,0.053371756
03-03-2020 03:05,b'RT @IgnacioTechie: #5G mmWave delivers unprecedented cellular speeds. With &gt;$11B committed by U.S. operators in recent mmWave spectrum auct\xe2\x80\xa6',mmWave delivers unprecedented cellular speeds With committed operators recent mmWave spectrum auct,0.3,0.575,,0.1725,,,
03-03-2020 02:52,b'RT @IgnacioTechie: #5G mmWave delivers unprecedented cellular speeds. With &gt;$11B committed by U.S. operators in recent mmWave spectrum auct\xe2\x80\xa6',mmWave delivers unprecedented cellular speeds With committed operators recent mmWave spectrum auct,0.3,0.575,,0.1725,,,
03-03-2020 02:49,b'RT @IgnacioTechie: #5G mmWave delivers unprecedented cellular speeds. With &gt;$11B committed by U.S. operators in recent mmWave spectrum auct\xe2\x80\xa6',mmWave delivers unprecedented cellular speeds With committed operators recent mmWave spectrum auct,0.3,0.575,,0.1725,,,
03-03-2020 02:48,b'#5G mmWave delivers unprecedented cellular speeds. With &gt;$11B committed by U.S. operators in recent mmWave spectrum\xe2\x80\xa6 https://t.co/w4l48B7o3S',mmWave delivers unprecedented cellular speeds With committed operators recent mmWave spectrum https,0.3,0.575,,0.1725,,,
02-03-2020 23:29,b'Off to the U.S. Cellular Center in Cedar Rapids for a Class 3A boys substate final tonight -- Mount Vernon (21-2) v\xe2\x80\xa6 https://t.co/LTZlH9nhIx',Cellular Center Cedar Rapids Class boys substate final tonight Mount Vernon https LTZlH nhIx,-0.05,0.55,,-0.0275,,,
02-03-2020 22:45,b'RT @MarionBoysBball: Substate Finals tonight vs. CPU at the U.S. Cellular Center. Tip off is at 6:30pm. Get there early and be loud!!! GO I\xe2\x80\xa6',Substate Finals tonight Cellular Center there early loud,0.033333333,0.4,,0.013333333,,,
02-03-2020 22:29,b'RT @MarionBoysBball: Substate Finals tonight vs. CPU at the U.S. Cellular Center. Tip off is at 6:30pm. Get there early and be loud!!! GO I\xe2\x80\xa6',Substate Finals tonight Cellular Center there early loud,0.033333333,0.4,,0.013333333,,,
02-03-2020 18:42,"b""Here's a #mustread link about #5G posted last week https://t.co/TqHguLPEV9 See the rest at https://t.co/do5JC1t5Ar""",Here mustread link about posted last week https TqHguLPEV rest https,0,0.066666667,,0,,,
02-03-2020 18:39,"b""RT @shahdings: u ever think ur not getting any notifications bc there's no wifi but u switch to cellular data and u still have zero notific\xe2\x80\xa6""",ever think getting notifications there wifi switch cellular data still have zero notific,0,0,,0,,,
02-03-2020 18:33,"b""u ever think ur not getting any notifications bc there's no wifi but u switch to cellular data and u still have zer\xe2\x80\xa6 https://t.co/BQdjBfndRo""",ever think getting notifications there wifi switch cellular data still have https BQdjBfndRo,0,0,,0,,,
14-03-2020 13:26,b'@Hayden_Magehee Check out our deals at U.S. Cellular: https://t.co/T11aNqCfrw. ^AH',Check deals Cellular https aNqCfrw,0,0,,0,,,
14-03-2020 11:26,"b'U.S. Cellular, no, sweetie, what are you doing? Stop that. https://t.co/D2HcVQzo4n'",Cellular sweetie what doing Stop that https HcVQzo,0,0,,0,,,
14-03-2020 09:20,b'Why do niggas be calling my cellular device like that\xe2\x80\x99s okay is u dumb',niggas calling cellular device like that okay dumb,0.0625,0.5,,0.03125,,,
14-03-2020 07:06,b'Now up on the auction block: Samsung Galaxy S6 Edge 32gb White SM-G925R4 (U.S Cellular) Discounted NW2288 $69.78 vi\xe2\x80\xa6 https://t.co/kUo6ltKiTH',auction block Samsung Galaxy Edge White Cellular Discounted https ltKiTH,0,0,,0,,,
14-03-2020 02:49,"b'RT @kjpilcher: Inside the U.S. Cellular Center in Cedar Rapids, D-III wrestlers were working out when they announced in the arena that the\xe2\x80\xa6'",Inside Cellular Center Cedar Rapids wrestlers were working when they announced arena that,-0.1,0.1,,-0.01,,,
14-03-2020 02:30,b'GRAND REOPENING: U.S. Cellular celebrated its grand reopening Friday morning in Fairmont with a ribbon cutting cele\xe2\x80\xa6 https://t.co/5Aq3vPIPkt',GRAND REOPENING Cellular celebrated grand reopening Friday morning Fairmont with ribbon cutting cele https vPIPkt,0.1875,0.9125,,0.17109375,,,
14-03-2020 02:09,b'RT @KCRG: The Five Flags Center in Dubuque and U.S. Cellular Center in Cedar Rapids announced Friday that they plan to reschedule the Harle\xe2\x80\xa6',Five Flags Center Dubuque Cellular Center Cedar Rapids announced Friday that they plan reschedule Harle,-0.1,0.1,,-0.01,,,
14-03-2020 01:00,b'RT @KCRG: The Five Flags Center in Dubuque and U.S. Cellular Center in Cedar Rapids announced Friday that they plan to reschedule the Harle\xe2\x80\xa6',Five Flags Center Dubuque Cellular Center Cedar Rapids announced Friday that they plan reschedule Harle,-0.1,0.1,,-0.01,,,
14-03-2020 00:15,b'The Five Flags Center in Dubuque and U.S. Cellular Center in Cedar Rapids announced Friday that they plan to resche\xe2\x80\xa6 https://t.co/6FcgWRdx0H',Five Flags Center Dubuque Cellular Center Cedar Rapids announced Friday that they plan resche https FcgWRdx,-0.1,0.1,,-0.01,,,
13-03-2020 20:59,"b'RT @kjpilcher: Inside the U.S. Cellular Center in Cedar Rapids, D-III wrestlers were working out when they announced in the arena that the\xe2\x80\xa6'",Inside Cellular Center Cedar Rapids wrestlers were working when they announced arena that,-0.1,0.1,,-0.01,,,
13-03-2020 20:01,"b'RT @kjpilcher: Inside the U.S. Cellular Center in Cedar Rapids, D-III wrestlers were working out when they announced in the arena that the\xe2\x80\xa6'",Inside Cellular Center Cedar Rapids wrestlers were working when they announced arena that,-0.1,0.1,,-0.01,,,
13-03-2020 19:52,"b'RT @kjpilcher: Inside the U.S. Cellular Center in Cedar Rapids, D-III wrestlers were working out when they announced in the arena that the\xe2\x80\xa6'",Inside Cellular Center Cedar Rapids wrestlers were working when they announced arena that,-0.1,0.1,,-0.01,,,
13-03-2020 18:36,"b'RT @kjpilcher: Inside the U.S. Cellular Center in Cedar Rapids, D-III wrestlers were working out when they announced in the arena that the\xe2\x80\xa6'",Inside Cellular Center Cedar Rapids wrestlers were working when they announced arena that,-0.1,0.1,,-0.01,,,
13-03-2020 18:17,"b'RT @kjpilcher: Inside the U.S. Cellular Center in Cedar Rapids, D-III wrestlers were working out when they announced in the arena that the\xe2\x80\xa6'",Inside Cellular Center Cedar Rapids wrestlers were working when they announced arena that,-0.1,0.1,,-0.01,,,
13-03-2020 18:13,"b'RT @kjpilcher: Inside the U.S. Cellular Center in Cedar Rapids, D-III wrestlers were working out when they announced in the arena that the\xe2\x80\xa6'",Inside Cellular Center Cedar Rapids wrestlers were working when they announced arena that,-0.1,0.1,,-0.01,,,
15-03-2020 04:48,"b'Game 1 at U.S. Cellular Field. Starting Pitchers: Lester (19-5, 2.45) vs. Contreras (15-7, 3.61). https://t.co/H6eTCEmtng'",Game Cellular Field Starting Pitchers Lester Contreras https eTCEmtng,-0.2,0.25,,-0.05,,,
15-03-2020 04:05,"b""We obviously don't know the long term side effects of this virus in the body , as a healer I can say it will stay i\xe2\x80\xa6 https://t.co/xGaIzJVLmI""",obviously know long term side effects this virus body healer will stay https xGaIzJVLmI,-0.025,0.45,,-0.01125,,,
15-03-2020 02:55,"b'RT @VictorGliva16: In a perfect world, right now I\xe2\x80\x99d be in the U.S. Cellular Center getting ready for my national finals match. Unfortunate\xe2\x80\xa6'",perfect world right Cellular Center getting ready national finals match Unfortunate,0.177142857,0.627142857,,0.111093878,,,
14-03-2020 22:35,"b'In a perfect world, right now I\xe2\x80\x99d be in the U.S. Cellular Center getting ready for my national finals match. Unfort\xe2\x80\xa6 https://t.co/iKBavxphOS'",perfect world right Cellular Center getting ready national finals match Unfort https iKBavxphOS,0.346428571,0.533928571,,0.184968112,,,
14-03-2020 18:01,"b'@RowdyGirl1818 Oh no. I also do online chat in addition to Social Media. I am very sorry, Lauren. 20 years is a lon\xe2\x80\xa6 https://t.co/0tGY7AwWlf'",also online chat addition Social Media very sorry Lauren years https AwWlf,-0.308333333,0.533333333,,-0.164444444,,,
14-03-2020 15:15,b'Sheboygan gets 5G coverage through U.S. Cellular https://t.co/UO67nDvwkm',Sheboygan gets coverage through Cellular https nDvwkm,0,0,,0,,,
13-03-2020 21:37,b'RT @Ookla5GMap: The largest new 5G commercial releases include EE in the U.K. and AT&amp;T Mobility and U.S. Cellular in the U.S. A few release\xe2\x80\xa6',largest commercial releases include Mobility Cellular release,0,0,,0,,,
16-03-2020 07:20,b'@KenidraRWoods_ Dang I use U.S cellular. \nI\xe2\x80\x99m very fortunate that I\xe2\x80\x99ll probably be able to pay it this month. I pra\xe2\x80\xa6 https://t.co/0b5564OJjU',Dang cellular very fortunate that probably able this month https OJjU,0,0,,0,,,
16-03-2020 02:32,b'I went to the store w my dad so he can get my Apple Watch and I want the 44mm cellular so the guy brought out 40mm\xe2\x80\xa6 https://t.co/66QVzS48hw',went store Apple Watch want cellular brought https QVzS,0,0,,0,,,
16-03-2020 02:20,"b""We're about ready to get started at U.S. Cellular Field. @MaddHalos' and @ozzieguillen's lineups are the same as th\xe2\x80\xa6 https://t.co/iPfzblHPN0""",about ready started Cellular Field lineups same https iPfzblHPN,-0.1,0.1,,-0.01,,,
15-03-2020 22:56,b'Apple Just Gave Millions Of Users A Reason To Quit Their iPhones https://t.co/RXf9YvgtiF',Apple Just Gave Millions Users Reason Quit Their iPhones https YvgtiF,0.1875,0.9125,,0.17109375,,,
15-03-2020 21:43,b'New Galaxy S 5 on EbaySamsung Galaxy S5 SM-G900R4 - 16GB - Charcoal Black (U.S. Cellular) Smartphone\xe2\x80\xa6 https://t.co/br1udNsuZ6',Galaxy EbaySamsung Galaxy Charcoal Black Cellular Smartphone https udNsuZ,-0.1,0.1,,-0.01,,,
15-03-2020 21:28,"b""@piersmorgan @MattHancock Life was better in the 80's when u didnt have hold of a cellular device""",Life better when didnt have hold cellular device,-0.1,0.1,,-0.01,,,
15-03-2020 20:51,"b'@kyliejustine For next 60 days, U.S. Cellular will not interrupt service for applicable customers who contact us ab\xe2\x80\xa6 https://t.co/lQ8q1u75ns'",next days Cellular will interrupt service applicable customers contact https,-0.1,0.1,,-0.01,,,
15-03-2020 18:47,"b""I wld' gt' lists/lists =of cellular # subject's of investigation called 90 days w/FISA - U'd go thru' @AnaCabrera\xe2\x80\xa6 https://t.co/j3SvCVTqTI""",lists lists cellular subject investigation called days FISA thru https SvCVTqTI,0,0,,0,,,
15-03-2020 17:44,"b'@jadetheruler For next 60 days, U.S. Cellular will not interrupt service for applicable customers who contact us ab\xe2\x80\xa6 https://t.co/8J6Ag4Ln1B'",next days Cellular will interrupt service applicable customers contact https,-0.2,0.25,,-0.05,,,
15-03-2020 16:24,b'Now up on the auction block: Samsung Galaxy S7 SM-G930 - 32GB - Gold Platinum (U.S. Cellular) Smartphone $47.00 via\xe2\x80\xa6 https://t.co/uX8OocKqG3',auction block Samsung Galaxy Gold Platinum Cellular Smartphone https OocKqG,-0.025,0.45,,-0.01125,,,
15-03-2020 16:17,"b'@NASCARHeat @amsupdates @NASCAR Me, I raced with Justin Allgaier\'s U.S. Cellular car and Kevin Harvick\'s ""HARVICK"" Beer playoff car.'",raced with Justin Allgaier Cellular Kevin Harvick HARVICK Beer playoff,0.177142857,0.627142857,,0.111093878,,,
15-03-2020 14:08,b'Why does my phone network spot say U.S Cellular.........? @sprint https://t.co/Eqtw9u4zTy',does phone network spot Cellular https Eqtw,0.346428571,0.533928571,,0.184968112,,,
15-03-2020 13:25,b'@LoKiisses You should come to U.S. Cellular. Check out our offers:  https://t.co/TssOT7y8X5.  ^AH',should come Cellular Check offers https TssOT,-0.308333333,0.533333333,,-0.164444444,,,
17-03-2020 02:46,b'RT @USCellular: @AuroraCarterr Most carriers are still billing just not suspending for 60 days. Are you a current U.S. Cellular customer? ^\xe2\x80\xa6',Most carriers still billing just suspending days current Cellular customer,0,0,,0,,,
17-03-2020 00:34,b'RT @Ookla5GMap: The largest new 5G commercial releases include EE in the U.K. and AT&amp;T Mobility and U.S. Cellular in the U.S. A few release\xe2\x80\xa6',largest commercial releases include Mobility Cellular release,0,0,,0,,,
16-03-2020 23:43,b'New Galaxy S 5 on EbaySamsung Galaxy S5 SM-G900R4 - 16GB - Charcoal Black (U.S. Cellular) Smartphone\xe2\x80\xa6 https://t.co/Kw92puDMjF',Galaxy EbaySamsung Galaxy Charcoal Black Cellular Smartphone https puDMjF,0,0,,0,,,
16-03-2020 20:26,"b'@TDETEAM_ I work for a company that sells phones for Verizon, ATT, U.S Cellular, and sprint. I\xe2\x80\x99m currently in a Wal\xe2\x80\xa6 https://t.co/oUyAlewlEC'",work company that sells phones Verizon Cellular sprint currently https oUyAlewlEC,0,0,,0,,,
16-03-2020 20:20,b'Apple Just Gave Millions Of Users A Reason To Quit Their iPhones. https://t.co/nmResytdTP',Apple Just Gave Millions Users Reason Quit Their iPhones https nmResytdTP,-0.1,0.1,,-0.01,,,
16-03-2020 19:20,b'@AuroraCarterr Most carriers are still billing just not suspending for 60 days. Are you a current U.S. Cellular customer? ^SA',Most carriers still billing just suspending days current Cellular customer,0.1875,0.9125,,0.17109375,,,
16-03-2020 18:57,b'Anyone else\xe2\x80\x99s cellphone thingy say \xe2\x80\x9cU.S Cellular\xe2\x80\x9d ?',Anyone else cellphone thingy Cellular,-0.1,0.1,,-0.01,,,
16-03-2020 18:20,"b'U.S. Cellular is committed to treating you fairly and providing you an excellent wireless experience, while keeping\xe2\x80\xa6 https://t.co/nVQdCzyyaY'",Cellular committed treating fairly providing excellent wireless experience while keeping https nVQdCzyyaY,-0.1,0.1,,-0.01,,,
16-03-2020 18:20,"b'U.S. Cellular is committed to treating you fairly and providing you an excellent wireless experience, while keeping\xe2\x80\xa6 https://t.co/LVP66H9bGZ'",Cellular committed treating fairly providing excellent wireless experience while keeping https,-0.1,0.1,,-0.01,,,
16-03-2020 18:20,"b'U.S. Cellular is committed to treating you fairly and providing you an excellent wireless experience, while keeping\xe2\x80\xa6 https://t.co/AoaYLMW6cz'",Cellular committed treating fairly providing excellent wireless experience while keeping https AoaYLMW,0,0,,0,,,
16-03-2020 18:20,"b'U.S. Cellular is committed to treating you fairly and providing you an excellent wireless experience, while keeping\xe2\x80\xa6 https://t.co/05ufIzMlYk'",Cellular committed treating fairly providing excellent wireless experience while keeping https ufIzMlYk,0.51,0.7675,,0.391425,,,
16-03-2020 18:02,b'Can\xe2\x80\x99t wait to switch to T-Mobile I\xe2\x80\x99m tired of u.s cellular',wait switch Mobile tired cellular,0,0,,0,,,
16-03-2020 18:01,"b'@Yungbiracial_ Like most all carriers, U.S. Cellular is also providing customers who contact us 60 days to pay thei\xe2\x80\xa6 https://t.co/3NyhdCLiDu'",Like most carriers Cellular also providing customers contact days thei https NyhdCLiDu,0.1,0.3125,,0.03125,,,
16-03-2020 14:56,b'@Kenopsiad Thank you for reaching out. Are you currently a U.S. Cellular customer? ^SA',Thank reaching currently Cellular customer,0,0,,0,,,
16-03-2020 13:39,b'@andres87452473 Only 10-digit United States (U.S.) cellular telephone numbers are eligible to receive a SafePass Co\xe2\x80\xa6 https://t.co/EXNsLk1Aoi',Only digit United States cellular telephone numbers eligible receive SafePass https EXNsLk,-0.166666667,0.433333333,,-0.072222222,,,
17-03-2020 17:19,b'NEW: The Justin Moore &amp; Tracy Lawrence concert at the U.S. Cellular Center later this month has been postponed. The\xe2\x80\xa6 https://t.co/wzmC6h0V4C',Justin Moore Tracy Lawrence concert Cellular Center later this month been postponed https wzmC,0.5,0.5,,0.25,,,
17-03-2020 14:32,b'RT @USCellular: @AuroraCarterr Most carriers are still billing just not suspending for 60 days. Are you a current U.S. Cellular customer? ^\xe2\x80\xa6',Most carriers still billing just suspending days current Cellular customer,0,0,,0,,,
17-03-2020 14:28,b'Spectrum &amp; U.S. Cellular\xf0\x9f\x9a\xae\xf0\x9f\xa4\xa6\xf0\x9f\x8f\xbd\xe2\x80\x8d\xe2\x99\x82\xef\xb8\x8f\xe2\x9d\x97',Spectrum Cellular,-0.166666667,0.333333333,,-0.055555556,,,
17-03-2020 06:16,"b'5 Ways 5G Will Impact Marketers:  \n\nBy the end of 2019, the four biggest U.S. cellular carriers rolled out 5G acros\xe2\x80\xa6 https://t.co/bmS0B315RS'",Ways Will Impact Marketers four biggest cellular carriers rolled acros https,0,0,,0,,,
17-03-2020 05:06,b'RT @USCellular: @AuroraCarterr Most carriers are still billing just not suspending for 60 days. Are you a current U.S. Cellular customer? ^\xe2\x80\xa6',Most carriers still billing just suspending days current Cellular customer,0,0,,0,,,
18-03-2020 07:03,b'#FCC - FCC Provides U.S. Cellular Temporary Access To Additional Spectrum To Help Keep Americans Connected During C\xe2\x80\xa6 https://t.co/MELpeEnM0W',Provides Cellular Temporary Access Additional Spectrum Help Keep Americans Connected During https MELpeEnM,0,0,,0,,,
18-03-2020 04:19,b'RT @FCC: The @FCC has granted Special Temporary Authority to U.S. Cellular to use additional spectrum to help meet increased customer deman\xe2\x80\xa6',granted Special Temporary Authority Cellular additional spectrum help meet increased customer deman,0,0,,0,,,
18-03-2020 04:06,"b'RT @matthewberryfcc: This afternoon, the FCC provided U.S. Cellular with temporary authority to use additional spectrum in parts of Califor\xe2\x80\xa6'",This afternoon provided Cellular with temporary authority additional spectrum parts Califor,0.1,0,,0,,,
18-03-2020 01:44,b'@jasen_lesieur80 bruh all our u s cellular stores are staying open til the end of april \xf0\x9f\x98\xad',bruh cellular stores staying open april,-0.2,0.25,,-0.05,,,
18-03-2020 01:29,"b'RT @matthewberryfcc: This afternoon, the FCC provided U.S. Cellular with temporary authority to use additional spectrum in parts of Califor\xe2\x80\xa6'",This afternoon provided Cellular with temporary authority additional spectrum parts Califor,-0.025,0.45,,-0.01125,,,
18-03-2020 01:27,b'@LmurdererMeta @TheQuartering Most likely. Apparently it also uses up your data secretly.\nhttps://t.co/KMCfslRgU1',Most likely Apparently also uses your data secretly nhttps KMCfslRgU,0.51,0.7675,,0.391425,,,
18-03-2020 01:01,b'RT @FCC: The @FCC has granted Special Temporary Authority to U.S. Cellular to use additional spectrum to help meet increased customer deman\xe2\x80\xa6',granted Special Temporary Authority Cellular additional spectrum help meet increased customer deman,0,0,,0,,,
18-03-2020 00:52,b'so every phone company BUT U.S Cellular extended phone bills\xf0\x9f\x98\xa1\xf0\x9f\x98\x82',every phone company Cellular extended phone bills,0.1,0.3125,,0.03125,,,
18-03-2020 00:24,b'RT @FCC: The @FCC has granted Special Temporary Authority to U.S. Cellular to use additional spectrum to help meet increased customer deman\xe2\x80\xa6',granted Special Temporary Authority Cellular additional spectrum help meet increased customer deman,0,0,,0,,,
18-03-2020 00:11,b'RT @FCC: The @FCC has granted Special Temporary Authority to U.S. Cellular to use additional spectrum to help meet increased customer deman\xe2\x80\xa6',granted Special Temporary Authority Cellular additional spectrum help meet increased customer deman,-0.166666667,0.433333333,,-0.072222222,,,
17-03-2020 23:55,b'Drinking a Fundamental Observation (2019) by @BottleLogicBrew @ U.S. Cellular Authorized Agent - Cellular Advantage\xe2\x80\xa6 https://t.co/J9ovwjWzht',Drinking Fundamental Observation Cellular Authorized Agent Cellular Advantage https ovwjWzht,0.5,0.5,,0.25,,,
17-03-2020 23:19,b'RT @FCC: The @FCC has granted Special Temporary Authority to U.S. Cellular to use additional spectrum to help meet increased customer deman\xe2\x80\xa6',granted Special Temporary Authority Cellular additional spectrum help meet increased customer deman,0,0,,0,,,
17-03-2020 23:08,b'RT @FCC: The @FCC has granted Special Temporary Authority to U.S. Cellular to use additional spectrum to help meet increased customer deman\xe2\x80\xa6',granted Special Temporary Authority Cellular additional spectrum help meet increased customer deman,-0.166666667,0.333333333,,-0.055555556,,,
17-03-2020 22:34,b'@NeverBeenBasic_ u.s cellular doing it too ?',cellular doing,0,0,,0,,,
17-03-2020 22:34,b'RT @FCC: The @FCC has granted Special Temporary Authority to U.S. Cellular to use additional spectrum to help meet increased customer deman\xe2\x80\xa6',granted Special Temporary Authority Cellular additional spectrum help meet increased customer deman,0,0,,0,,,
18-03-2020 17:37,b'U.S. Cellular gets access to more spectrum\n#MobileBroadband #Newlevel\n\nSource: https://t.co/lk5mr67xQI\nBy https://t.co/FEmp3sijJF',Cellular gets access more spectrum MobileBroadband Newlevel nSource https https FEmp sijJF,0,0,,0,,,
18-03-2020 16:53,b'The SARA-R410M-63B modules from  @ublox are developed for mission-critical #IoT solutions. These modules feature im\xe2\x80\xa6 https://t.co/dPF0XoUqNO',SARA modules from developed mission critical solutions These modules feature https XoUqNO,0,0,,0,,,
18-03-2020 16:14,b'RT @FCC: The @FCC has granted Special Temporary Authority to U.S. Cellular to use additional spectrum to help meet increased customer deman\xe2\x80\xa6',granted Special Temporary Authority Cellular additional spectrum help meet increased customer deman,0.1,0,,0,,,
18-03-2020 16:11,"b'Sprint cellular, doesn\xe2\x80\x99t appear to care about keeping a customer of over 16 years. All they seem to care about is a\xe2\x80\xa6 https://t.co/v0KBGt5gPr'",Sprint cellular doesn appear care about keeping customer over years they seem care about https KBGt,-0.2,0.25,,-0.05,,,
18-03-2020 14:58,b'U.S. Cellular Gets More Spectrum Amid Coronavirus Scare https://t.co/wrj2uH12Wi https://t.co/XMsyeRxZkr',Cellular Gets More Spectrum Amid Coronavirus Scare https https XMsyeRxZkr,-0.025,0.45,,-0.01125,,,
18-03-2020 14:37,"b'Thank you, @USCellular for getting my dad up and running... U.S. Cellular makes it easy even a stubborn old grandpa\xe2\x80\xa6 https://t.co/lQX8Madirb'",Thank getting running Cellular makes easy even stubborn grandpa https Madirb,0.25,0.45,,0.1125,,,
18-03-2020 14:09,b'RT @FCC: The @FCC has granted Special Temporary Authority to U.S. Cellular to use additional spectrum to help meet increased customer deman\xe2\x80\xa6',granted Special Temporary Authority Cellular additional spectrum help meet increased customer deman,0,0,,0,,,
18-03-2020 13:33,"b""Three major U.S. carriers have #certified the @Quectel #LPWA module BG95-M3 for operation on the carriers' wireless\xe2\x80\xa6 https://t.co/5BcmoLyfx5""",Three major carriers have certified LPWA module operation carriers wireless https BcmoLyfx,-0.166666667,0.433333333,,-0.072222222,,,
18-03-2020 13:03,b'$QCOM $USM $MSI $TMUS:\n\nU.S. Cellular Gets More Spectrum Amid Coronavirus Scare:\n\nhttps://t.co/yW7RfIsLbW',QCOM TMUS Cellular Gets More Spectrum Amid Coronavirus Scare nhttps RfIsLbW,0,0.4,,0,,,
18-03-2020 13:01,b'FCC gives U.S. Cellular OK to call on more spectrum https://t.co/gwO735CaDC @fcc @uscellular #spectrum #wirelessspectrum #wireless #5g',gives Cellular call more spectrum https CaDC spectrum wirelessspectrum wireless,0,0,,0,,,
18-03-2020 23:57,b'@KevinBreezeTV R.I.P. U.S. Cellular \xf0\x9f\x98\x82\xf0\x9f\x98\x82',Cellular,0.25,0.45,,0.1125,,,
18-03-2020 22:12,b'The @FCC grants Verizon temporary spectrum access (the agency has done similar requests for T-Mobile and U.S. Cellu\xe2\x80\xa6 https://t.co/wn0oGhnIcn',grants Verizon temporary spectrum access agency done similar requests Mobile Cellu https oGhnIcn,0,0,,0,,,
18-03-2020 22:00,b'U.S. Cellular gets access to more spectrum for COVID-19 response https://t.co/K25uFkPrpF',Cellular gets access more spectrum COVID response https uFkPrpF,0.85,0.95,,0.8075,,,
18-03-2020 20:07,b'U.S. Cellular gets access to more spectrum for COVID-19 response https://t.co/wfWWrdbhW6',Cellular gets access more spectrum COVID response https wfWWrdbhW,0.85,0.95,,0.8075,,,
18-03-2020 19:37,b'RT @pcohen21: The SARA-R410M-63B modules from  @ublox are developed for mission-critical #IoT solutions. These modules feature immutable ro\xe2\x80\xa6',SARA modules from developed mission critical solutions These modules feature immutable,0.85,0.95,,0.8075,,,
