,Tweets,clean_tweet,polarity,subjectivity,,Product,,,
24-03-2020 20:00,"b'#SocialDistancing is hard, but it doesn\xe2\x80\x99t have to be boring. For tips from @USCellular on connecting, entertaining\xe2\x80\xa6 https://t.co/LpIwhj9pfL'",SocialDistancing hard doesn have boring tips from connecting entertaining https LpIwhj,0.357142857,0.571428571,,0.204081633,,,
27-03-2020 05:13,b'U R right on virus. Everyone Honest takes 1 look @ that cellular structure(w/2dna strands of AIDS Virus added in ju\xe2\x80\xa6 https://t.co/BhKDQDuwan',right virus Everyone Honest takes look that cellular structure strands AIDS Virus added https BhKDQDuwan,0.0625,0.5,,0.03125,,,
26-03-2020 21:17,b'Price: (as of  - Details)\n\n            Product Description\n\n            IMPORTANT NOTES(Please Read Before Purchase\xe2\x80\xa6 https://t.co/zjRlaLAEvZ',Price Details Product Description IMPORTANT NOTES Please Read Before Purchase https zjRlaLAEvZ,0.5,0.5,,0.25,,,
26-03-2020 21:06,b'Is U.S Cellular still open \xf0\x9f\x99\x84\xf0\x9f\x99\x84\xf0\x9f\x99\x84',Cellular still open,0.5,0.5,,0.25,,,
26-03-2020 19:56,b'@naomirwolf The cellular network comprises the infrastructure for a heinous #neuroweapon grid that elements of the\xe2\x80\xa6 https://t.co/ynZA5qvKNC',cellular network comprises infrastructure heinous neuroweapon grid that elements https ynZA qvKNC,0,0,,0,,,
26-03-2020 19:52,b'@naomirwolf The cellular network comprises the infrastructure for a heinous #neuroweapon grid that elements of the\xe2\x80\xa6 https://t.co/ksW8j6jXR7',cellular network comprises infrastructure heinous neuroweapon grid that elements https,0.357142857,0.571428571,,0.204081633,,,
26-03-2020 19:09,"b'@SneedTech AT&amp;T,Sprint,Tmobile,Verizon, U.S.Cellular, and spectrum internet.'",Sprint Tmobile Verizon Cellular spectrum internet,0,0,,0,,,
26-03-2020 17:48,b'US Cellular every month: \xe2\x80\x9cFree U.S. Cellular Msg: Great news!  We lowered your bill this month.  You earned a Payba\xe2\x80\xa6 https://t.co/UOHVkgLVyr',Cellular every month cFree Cellular Great news lowered your bill this month earned Payba https UOHVkgLVyr,0,0.5,,0,,,
26-03-2020 16:06,"b'RT @mikeddano: OFFICIAL numbers from @CTIA from Verizon, AT&amp;T, T-Mobile, Sprint and U.S. Cellular:\n\nMobile voice traffic up 24.3%\nMobile da\xe2\x80\xa6'",OFFICIAL numbers from from Verizon Mobile Sprint Cellular nMobile voice traffic nMobile,0,0,,0,,,
26-03-2020 15:33,"b'RT @mikeddano: OFFICIAL numbers from @CTIA from Verizon, AT&amp;T, T-Mobile, Sprint and U.S. Cellular:\n\nMobile voice traffic up 24.3%\nMobile da\xe2\x80\xa6'",OFFICIAL numbers from from Verizon Mobile Sprint Cellular nMobile voice traffic nMobile,0.5,0.5,,0.25,,,
26-03-2020 15:28,"b'RT @mikeddano: OFFICIAL numbers from @CTIA from Verizon, AT&amp;T, T-Mobile, Sprint and U.S. Cellular:\n\nMobile voice traffic up 24.3%\nMobile da\xe2\x80\xa6'",OFFICIAL numbers from from Verizon Mobile Sprint Cellular nMobile voice traffic nMobile,0.05,0.55,,0.0275,,,
26-03-2020 15:22,"b'RT @mikeddano: OFFICIAL numbers from @CTIA from Verizon, AT&amp;T, T-Mobile, Sprint and U.S. Cellular:\n\nMobile voice traffic up 24.3%\nMobile da\xe2\x80\xa6'",OFFICIAL numbers from from Verizon Mobile Sprint Cellular nMobile voice traffic nMobile,0.357142857,0.571428571,,0.204081633,,,
26-03-2020 15:09,"b'RT @mikeddano: OFFICIAL numbers from @CTIA from Verizon, AT&amp;T, T-Mobile, Sprint and U.S. Cellular:\n\nMobile voice traffic up 24.3%\nMobile da\xe2\x80\xa6'",OFFICIAL numbers from from Verizon Mobile Sprint Cellular nMobile voice traffic nMobile,0,0,,0,,,
26-03-2020 15:08,"b'RT @mikeddano: OFFICIAL numbers from @CTIA from Verizon, AT&amp;T, T-Mobile, Sprint and U.S. Cellular:\n\nMobile voice traffic up 24.3%\nMobile da\xe2\x80\xa6'",OFFICIAL numbers from from Verizon Mobile Sprint Cellular nMobile voice traffic nMobile,0.5,0.5,,0.25,,,
26-03-2020 15:06,"b'RT @mikeddano: OFFICIAL numbers from @CTIA from Verizon, AT&amp;T, T-Mobile, Sprint and U.S. Cellular:\n\nMobile voice traffic up 24.3%\nMobile da\xe2\x80\xa6'",OFFICIAL numbers from from Verizon Mobile Sprint Cellular nMobile voice traffic nMobile,0.433333333,0.833333333,,0.361111111,,,
28-03-2020 19:28,b'In case anyone else has u.s. cellular and hasn\xe2\x80\x99t seen this https://t.co/WG7ZDvWVvt',case anyone else cellular hasn seen this https ZDvWVvt,0.357142857,0.571428571,,0.204081633,,,
28-03-2020 18:21,b'@GmurphNBCS When I was in Chicago the cubs where in Milwaukee so we seen u.s. cellular field which was nice and tho\xe2\x80\xa6 https://t.co/qgyHUOfq5u',When Chicago cubs where Milwaukee seen cellular field which nice https qgyHUOfq,0.0625,0.5,,0.03125,,,
28-03-2020 17:30,"b'@Stadium 7... target field, U.S. cellular, Wrigley, Yankee Stadium, AT&amp;T Park, Tropicana, and Miller Park'",target field cellular Wrigley Yankee Stadium Park Tropicana Miller Park,0.5,0.5,,0.25,,,
28-03-2020 16:34,"b'NATURES NATURAL IMMUNE SYSTEM BOOSTERS \n\nOver 98,000 scientific studies and articles on Glutathione are recorded in\xe2\x80\xa6 https://t.co/rnbAB6c9FC'",NATURES NATURAL IMMUNE SYSTEM BOOSTERS nOver scientific studies articles Glutathione recorded https rnbAB,0.5,0.5,,0.25,,,
28-03-2020 15:49,"b'NATURES NATURAL IMMUNE SYSTEM BOOSTERS\n\nOver 98,000 scientific studies and articles on Glutathione are recorded in\xe2\x80\xa6 https://t.co/a1psoXp6T8'",NATURES NATURAL IMMUNE SYSTEM BOOSTERS nOver scientific studies articles Glutathione recorded https psoXp,0,0,,0,,,
28-03-2020 15:34,"b""Yo. Generation X was the first people's to quarantine in the U.S. before any other generation. I think its because\xe2\x80\xa6 https://t.co/sqcZbPEdad""",Generation first people quarantine before other generation think because https sqcZbPEdad,0.357142857,0.571428571,,0.204081633,,,
28-03-2020 12:55,"b'RT @ScottGottliebMD: It\xe2\x80\x99s very likely that we\xe2\x80\x99ll see additional approvals of POC diagnostics behind this one, extending testing to doctor o\xe2\x80\xa6'",very likely that additional approvals diagnostics behind this extending testing doctor,0,0,,0,,,
28-03-2020 12:22,"b'RT @SteveFDA: In addition, the bill includes legislation that will reform and modernize the way that certain over-the-counter (OTC) drugs a\xe2\x80\xa6'",addition bill includes legislation that will reform modernize that certain over counter drugs,0,0.5,,0,,,
28-03-2020 07:59,b'RT @bethterhune05: U.S. Cellular for President https://t.co/sP3HKjcSEc',Cellular President https HKjcSEc,0,0,,0,,,
28-03-2020 05:07,"b'RT @mikeddano: OFFICIAL numbers from @CTIA from Verizon, AT&amp;T, T-Mobile, Sprint and U.S. Cellular:\n\nMobile voice traffic up 24.3%\nMobile da\xe2\x80\xa6'",OFFICIAL numbers from from Verizon Mobile Sprint Cellular nMobile voice traffic nMobile,0,0,,0,,,
28-03-2020 04:54,b'RT @DiMoraGifts: The U.S. Food and Drug Administration (FDA) has published the results of an eye-opening investigation which found that the\xe2\x80\xa6',Food Drug Administration published results opening investigation which found that,0,0.4,,0,,,
28-03-2020 02:25,"b'U.S. Cellular msg: Keeping you connected is our top priority as the COVID-19 situation evolves. Through May, no mat\xe2\x80\xa6 https://t.co/Ag7SuDQ4yf'",Cellular Keeping connected priority COVID situation evolves Through https SuDQ,0.5,0.5,,0.25,,,
28-03-2020 02:09,b'why did 12 yr old me follow u.s. cellular',follow cellular,0.5,0.5,,0.25,,,
28-03-2020 01:41,b'RT @NATEsafety: U.S. Cellular Taking Additional Steps to Keep Customers Connected https://t.co/AsPkZL0JIb via @tdjnews',Cellular Taking Additional Steps Keep Customers Connected https AsPkZL,0.05,0.55,,0.0275,,,
28-03-2020 01:35,b'THANK YOOOOOOUUUUUUU U.S. CELLULAR!!!!!! https://t.co/fRqSAdlwiP',THANK YOOOOOOUUUUUUU CELLULAR https fRqSAdlwiP,0.05,0.55,,0.0275,,,
29-03-2020 19:56,b'First: U.S. Cellular Field (White Sox)\nLast: Guaranteed Rate Field (White Sox)\nBest Stadium: Coors Field (Rockies)\xe2\x80\xa6 https://t.co/bW0aHrXKqf',First Cellular Field White nLast Guaranteed Rate Field White nBest Stadium Coors Field Rockies https aHrXKqf,0.05,0.35,,0.0175,,,
29-03-2020 19:40,b'Baseball version:\nFirst stadium: Wrigley\nLast stadium: Great American Ballpark\nBest stadium: Wrigley (Fenway is a c\xe2\x80\xa6 https://t.co/JOBFpcGgCo',Baseball version nFirst stadium Wrigley nLast stadium Great American Ballpark nBest stadium Wrigley Fenway https JOBFpcGgCo,0.5,0.5,,0.25,,,
29-03-2020 19:24,b'@Emmskis2 @iggypop23 @jaredtg12 1. Fenway \n2. GABP\n3. New Yankee Stadium\n4. Old Yankee Stadium \n5. Comerica Park\n6.\xe2\x80\xa6 https://t.co/e00VlOaF9L',Fenway GABP Yankee Stadium Yankee Stadium Comerica Park https VlOaF,0.5,0.5,,0.25,,,
29-03-2020 19:22,"b'RT @NutraRelief: NATURES NATURAL IMMUNE SYSTEM BOOSTERS\n\nOver 98,000 scientific studies and articles on Glutathione are recorded in PubMed,\xe2\x80\xa6'",NATURES NATURAL IMMUNE SYSTEM BOOSTERS nOver scientific studies articles Glutathione recorded PubMed,0.05,0.55,,0.0275,,,
29-03-2020 19:22,"b'RT @NutraReliefInc: NATURES NATURAL IMMUNE SYSTEM BOOSTERS \n\nOver 98,000 scientific studies and articles on Glutathione are recorded in Pub\xe2\x80\xa6'",NATURES NATURAL IMMUNE SYSTEM BOOSTERS nOver scientific studies articles Glutathione recorded,0.357142857,0.571428571,,0.204081633,,,
29-03-2020 18:59,"b""Stadiums i've been to ranked\n\n1. Miller Park\n2. U.S. Cellular field\n3. Lincoln Memorial Stadium\n4. Mid America Cent\xe2\x80\xa6 https://t.co/KLhCm0T3d0""",Stadiums been ranked Miller Park Cellular field Lincoln Memorial Stadium America Cent https KLhCm,0,0,,0,,,
29-03-2020 18:28,"b'7. U.S. Cellular (Guaranteed Rate) Field, home of the White Sox.\n\nJust boring. No cool backdrop, no special food op\xe2\x80\xa6 https://t.co/TH2bKDoEh1'",Cellular Guaranteed Rate Field home White nJust boring cool backdrop special food https bKDoEh,0.5,0.5,,0.25,,,
29-03-2020 18:25,"b'First: U.S. Cellular Field\nLast: Dee Events Center\nBest: tie, T-Mobile Arena/Vaught-Hemingway Stadium\nWorst: All-St\xe2\x80\xa6 https://t.co/ypz7NVSua9'",First Cellular Field nLast Events Center nBest Mobile Arena Vaught Hemingway Stadium nWorst https NVSua,0.433333333,0.833333333,,0.361111111,,,
29-03-2020 18:22,b'@fun88eng U.S. Cellular\nBusch\nBusch\nTropicana',Cellular nBusch nBusch nTropicana,0.357142857,0.571428571,,0.204081633,,,
29-03-2020 18:14,b'U.S. Cellular Field\nSoldier Field\nLincoln Financial Field\nOakland Alameda County Coliseum https://t.co/nUHbRaaT9t',Cellular Field nSoldier Field nLincoln Financial Field nOakland Alameda County Coliseum https nUHbRaaT,0.5,0.5,,0.25,,,
29-03-2020 18:13,b'Astrodome \nMinute Maid Park\nWrigley Field\nU.S. Cellular Field\nFenway Park\nGlobe Life Park\nAT&amp;T/Oracle Park\nOakland\xe2\x80\xa6 https://t.co/MVAio2DaQc',Astrodome nMinute Maid Park nWrigley Field Cellular Field nFenway Park nGlobe Life Park Oracle Park nOakland https MVAio DaQc,0,0,,0,,,
29-03-2020 18:11,b'Tigers Stadium\nWintrust Arena\nWrigley Field\nU.S. Cellular Field or Old Yankees Stadium https://t.co/6jkYrrlns8',Tigers Stadium nWintrust Arena nWrigley Field Cellular Field Yankees Stadium https jkYrrlns,0.5,0.5,,0.25,,,
29-03-2020 18:07,"b""First stadium: bush stadium I, last stadium united center, best stadium: Children's Mercy, worst stadium: U.s. Cell\xe2\x80\xa6 https://t.co/vC6mf7w07W""",First stadium bush stadium last stadium united center best stadium Children Mercy worst stadium Cell https,0,0,,0,,,
29-03-2020 18:01,b'@fun88eng Cobo Arena\nLittle Caesars Arena\nTiger Stadium \nU.S. Cellular Field',Cobo Arena nLittle Caesars Arena nTiger Stadium Cellular Field,0.05,0.55,,0.0275,,,
29-03-2020 18:00,b'First Stadium: U.S. Cellular Field (White Sox)\nLast Stadium: SunTrust Park\nBest Stadium: Yankee Stadium\nWorst Stadi\xe2\x80\xa6 https://t.co/tm8UDZQq15',First Stadium Cellular Field White nLast Stadium SunTrust Park nBest Stadium Yankee Stadium nWorst Stadi https UDZQq,0.4,0.875,,0.35,,,
31-03-2020 15:16,"b'Now hiring for 60 job opportunities at Cellular Sales (@JoinCellular), MDLZ (@MDLZ), U.S. Bank (@Elleywood1), and more.'",hiring opportunities Cellular Sales MDLZ Bank more,-0.2,0.2,,-0.04,,,
31-03-2020 13:47,"b'U.S.Cellular and CDC advise, clean your devices - Knox VillageSoup https://t.co/et6nqnVqn1 https://t.co/Jl0IZdi3Bb'",Cellular advise clean your devices Knox VillageSoup https nqnVqn https IZdi,-0.4,0.4,,-0.16,,,
31-03-2020 11:59,b'RT @NATEsafety: U.S. Cellular Taking Additional Steps to Keep Customers Connected https://t.co/2xMWnUqjFr Towers List @InsideTowers @USCell\xe2\x80\xa6',Cellular Taking Additional Steps Keep Customers Connected https xMWnUqjFr Towers List,0.375,0.975,,0.365625,,,
31-03-2020 11:55,b'RT @NATEsafety: U.S. Cellular Taking Additional Steps to Keep Customers Connected https://t.co/2xMWnUqjFr Towers List @InsideTowers @USCell\xe2\x80\xa6',Cellular Taking Additional Steps Keep Customers Connected https xMWnUqjFr Towers List,0,0,,0,,,
31-03-2020 11:45,b'RT @NATEsafety: U.S. Cellular Taking Additional Steps to Keep Customers Connected https://t.co/2xMWnUqjFr Towers List @InsideTowers @USCell\xe2\x80\xa6',Cellular Taking Additional Steps Keep Customers Connected https xMWnUqjFr Towers List,0,0.4,,0,,,
31-03-2020 11:43,b'U.S. Cellular Taking Additional Steps to Keep Customers Connected https://t.co/2xMWnUqjFr Towers List @InsideTowers\xe2\x80\xa6 https://t.co/aftPT0Z1FT',Cellular Taking Additional Steps Keep Customers Connected https xMWnUqjFr Towers List https aftPT,0.5,0.5,,0.25,,,
31-03-2020 03:13,b'U.S. Cellular gets access to more spectrum for COVID-19 response https://t.co/9NwXlNvYci #COVID19 #Internet #DataSpeeds',Cellular gets access more spectrum COVID response https NwXlNvYci COVID Internet DataSpeeds,0.5,0.5,,0.25,,,
30-03-2020 23:59,b'First ballpark: Riverfront Stadium (meh)\nLast ballpark: Great American Ball Park\nBest ballpark: PNC Park (tie) Orac\xe2\x80\xa6 https://t.co/LiMwH6k4J3',First ballpark Riverfront Stadium nLast ballpark Great American Ball Park nBest ballpark Park Orac https LiMwH,0.05,0.55,,0.0275,,,
30-03-2020 18:32,"b'Now On eBay!  Apple iPad Pro 3rd Gen. 512GB, Wi-Fi + 4G (U.S. Cellular), 12.9 in - Space Gray\xe2\x80\xa6 https://t.co/ZZAhf4XwbG'",eBay Apple iPad Cellular Space Gray https ZZAhf XwbG,0.05,0.55,,0.0275,,,
30-03-2020 18:17,"b""Regarding cellular #emoji, I'm still at a loss as to how DoCoMo's 0xF953 (U+E6AF PUA) differed from the related cod\xe2\x80\xa6 https://t.co/oszboFQTqX""",Regarding cellular emoji still loss DoCoMo differed from related https oszboFQTqX,0,1,,0,,,
30-03-2020 17:20,"b'Switch to U.S. Cellular\xc2\xae and get the iPhone 11 for $0 on us. We remain open to serve our Kenosha community, so chec\xe2\x80\xa6 https://t.co/le00Xq37zX'",Switch Cellular iPhone remain open serve Kenosha community chec https,0,0,,0,,,
30-03-2020 17:20,"b'Switch to U.S. Cellular\xc2\xae and get the iPhone 11 for $0 on us. We remain open to serve our Bangor community, so check\xe2\x80\xa6 https://t.co/SBtK8QiBME'",Switch Cellular iPhone remain open serve Bangor community check https SBtK QiBME,-0.077777778,0.144444444,,-0.011234568,,,
30-03-2020 14:07,b'@DevanFink Camden Yards\nChase Field\nCiti Field\nCitizens Bank Park\nDodger Stadium\nGABP\nFenway Park\nMarlins Park\nMinu\xe2\x80\xa6 https://t.co/6SKjj2AUwr',Camden Yards nChase Field nCiti Field nCitizens Bank Park nDodger Stadium nGABP nFenway Park nMarlins Park nMinu https SKjj AUwr,0.05,0.05,,0.0025,,,
30-03-2020 13:26,b'First Stadium: U.S Cellular Field (now called Guaranteed Rate Field- White Sox)\nLast Stadium: Bankers Life Fieldhou\xe2\x80\xa6 https://t.co/ka1FoUV90j',First Stadium Cellular Field called Guaranteed Rate Field White nLast Stadium Bankers Life Fieldhou https FoUV,0.05,0.05,,0.0025,,,
30-03-2020 13:20,b'@DevanFink Yankee Stadium (Old &amp; New)\nCiti Field (&amp; Shea Stadium)\nCamden Yards\nCitizens Bank Park\nFenway Park\nNatio\xe2\x80\xa6 https://t.co/KNNJ2Rm7xt',Yankee Stadium nCiti Field Shea Stadium nCamden Yards nCitizens Bank Park nFenway Park nNatio https KNNJ,0.05,0.05,,0.0025,,,
01-04-2020 16:30,"b'@rjkvikings with subsequent availability at Verizon, U.S. Cellular, Consumer Cellular, Google Fi, Republic Wireless\xe2\x80\xa6 https://t.co/ViXXzGkQbz'",with subsequent availability Verizon Cellular Consumer Cellular Google Republic Wireless https ViXXzGkQbz,0,0,,0,,,
01-04-2020 15:35,b'5G is a go U.S. Cellular turns on network for northern Iowa customers #Coronavirus\n03/08/2020\nhttps://t.co/8DQ2KPZKpl',Cellular turns network northern Iowa customers Coronavirus nhttps KPZKpl,0,1,,0,,,
01-04-2020 15:21,b'RT @MoKatibeh: Watch the jump in cellular traffic stemming from NYC in just one week. And we\xe2\x80\x99ll see the same across the U.S. But our networ\xe2\x80\xa6',Watch jump cellular traffic stemming from just week same across networ,0.4,0.5,,0.2,,,
01-04-2020 14:47,"b'RT @tmj_ut_sales: Check out the 69 latest openings at Cellular Sales (@JoinCellular), U.S. Bank (@Elleywood1), Getinge (@JoinGetinge), and\xe2\x80\xa6'",Check latest openings Cellular Sales Bank Getinge,0.4,0.5,,0.2,,,
01-04-2020 14:46,"b'Check out the 69 latest openings at Cellular Sales (@JoinCellular), U.S. Bank (@Elleywood1), Getinge (@JoinGetinge), and more.'",Check latest openings Cellular Sales Bank Getinge more,0.333333333,0.566666667,,0.188888889,,,
01-04-2020 14:30,b'RT @MoKatibeh: Watch the jump in cellular traffic stemming from NYC in just one week. And we\xe2\x80\x99ll see the same across the U.S. But our networ\xe2\x80\xa6',Watch jump cellular traffic stemming from just week same across networ,0,0.5,,0,,,
01-04-2020 14:00,b'RT @MoKatibeh: Watch the jump in cellular traffic stemming from NYC in just one week. And we\xe2\x80\x99ll see the same across the U.S. But our networ\xe2\x80\xa6',Watch jump cellular traffic stemming from just week same across networ,0,0,,0,,,
01-04-2020 13:53,b'RT @MoKatibeh: Watch the jump in cellular traffic stemming from NYC in just one week. And we\xe2\x80\x99ll see the same across the U.S. But our networ\xe2\x80\xa6',Watch jump cellular traffic stemming from just week same across networ,0.5,0.5,,0.25,,,
01-04-2020 13:12,b'@koreanjewcrypto Growin up 80s 90s u d have a few kids in entire school wit autism n cancer unthinkable. Most blame\xe2\x80\xa6 https://t.co/Eg3gQ12Awg',Growin have kids entire school autism cancer unthinkable Most blame https,0,0,,0,,,
01-04-2020 13:09,b'Oklahoma City OK USA - Retail Wireless Sales Consultant Full-Time OKC/Quail - Retail Wireless Sales : Retail Wirele\xe2\x80\xa6 https://t.co/ttleJS190a',Oklahoma City Retail Wireless Sales Consultant Full Time Quail Retail Wireless Sales Retail Wirele https ttleJS,0,0,,0,,,
01-04-2020 12:57,b'RT @MoKatibeh: Watch the jump in cellular traffic stemming from NYC in just one week. And we\xe2\x80\x99ll see the same across the U.S. But our networ\xe2\x80\xa6',Watch jump cellular traffic stemming from just week same across networ,0.2,0.2,,0.04,,,
01-04-2020 12:20,b'RT @MoKatibeh: Watch the jump in cellular traffic stemming from NYC in just one week. And we\xe2\x80\x99ll see the same across the U.S. But our networ\xe2\x80\xa6',Watch jump cellular traffic stemming from just week same across networ,0.25,0.3,,0.075,,,
01-04-2020 11:57,b'RT @MoKatibeh: Watch the jump in cellular traffic stemming from NYC in just one week. And we\xe2\x80\x99ll see the same across the U.S. But our networ\xe2\x80\xa6',Watch jump cellular traffic stemming from just week same across networ,0.4,0.8,,0.32,,,
01-04-2020 11:41,b'RT @MoKatibeh: Watch the jump in cellular traffic stemming from NYC in just one week. And we\xe2\x80\x99ll see the same across the U.S. But our networ\xe2\x80\xa6',Watch jump cellular traffic stemming from just week same across networ,0.4,0.8,,0.32,,,
01-04-2020 08:04,b'RT @ypakora: med school questions should be like \xe2\x80\x9chow do u want to die and explain the pathophysiology behind said mechanism of death inclu\xe2\x80\xa6',school questions should like chow want explain pathophysiology behind said mechanism death inclu,0,0,,0,,,
07-03-2020 09:20,"b""A good cellular connection is so important  cox it keeps u connected no matter how bad other networks are... That's\xe2\x80\xa6 https://t.co/I5uRCHZMrr""",good cellular connection important keeps connected matter other networks That https uRCHZMrr,0,0,,0,,,
,,,0,0,,0,,,
07-03-2020 04:42,b'@_Concretee U.S Cellular can save the voicemail and email you a file of it! They did that for my dads',Cellular save voicemail email file They that dads,0.8,1,,0.8,,,
07-03-2020 01:41,"b'@joelr9801 @ckkirsch1 Dennis O\xe2\x80\x99Brien, owner and CEO of Digicel in Haiti, personally traveled every 2 months in his\xe2\x80\xa6 https://t.co/jWqtYFeLfF'",Dennis Brien owner Digicel Haiti personally traveled every months https jWqtYFeLfF,0,0,,0,,,
07-03-2020 00:05,b'RT @craigrock2776: well I thank you for your answer u.s. cellular I am sorry also that you could not provide us with any of these apps mayb\xe2\x80\xa6',well thank your answer cellular sorry also that could provide with these apps mayb,0,0,,0,,,
07-03-2020 00:04,b'well I thank you for your answer u.s. cellular I am sorry also that you could not provide us with any of these apps\xe2\x80\xa6 https://t.co/q87zIiUmum',well thank your answer cellular sorry also that could provide with these apps https zIiUmum,0,0,,0,,,
07-03-2020 00:02,b'At&amp;T Mobility and U.S. Cellular both have several new deployments all around the United States. Play in Poland also\xe2\x80\xa6 https://t.co/DTRrRncyyT',Mobility Cellular both have several deployments around United States Play Poland also https DTRrRncyyT,0,0,,0,,,
06-03-2020 23:42,b'u.s. cellular we will be getting back ahold of you as soon as we are done',cellular will getting back ahold soon done,0,0,,0,,,
06-03-2020 23:40,b'u.s. cellular we are looking through your apps and we are reading about your company on my tablet right now I see a\xe2\x80\xa6 https://t.co/G8IYOZnNyr',cellular looking through your apps reading about your company tablet right https IYOZnNyr,0.4,0.7,,0.28,,,
06-03-2020 23:38,b'u.s. cellular as soon as I ask you a few questions then I got a answer from T-Mobile but then when we went to answe\xe2\x80\xa6 https://t.co/2AhLbPeBBq',cellular soon questions then answer from Mobile then when went answe https AhLbPeBBq,0.03125,0.416666667,,0.013020833,,,
06-03-2020 23:37,b'@KonstantinMetz @TMobileHelp you know how many times I have reached out to them and they just act like the customer\xe2\x80\xa6 https://t.co/mrevkhIDjR',know many times have reached them they just like customer https mrevkhIDjR,0,0,,0,,,
06-03-2020 23:34,"b""@USCellularCares hello u.s. cellular and thank you for contacting us we'd like to know how much you would charge fo\xe2\x80\xa6 https://t.co/SUzGlOi9tY""",hello cellular thank contacting like know much would charge https SUzGlOi,-0.15,0.333333333,,-0.05,,,
06-03-2020 23:33,b'wow this is about the coolest I get a answer from u.s. cellular asking me to come be one of their customers wow I t\xe2\x80\xa6 https://t.co/BEiiUUsMJE',this about coolest answer from cellular asking come their customers https BEiiUUsMJE,0.295833333,0.395833333,,0.117100694,,,
06-03-2020 22:54,b'@USCellularCares @USCellular I\xe2\x80\x99ve spoke with every1 I know &amp; no 1 has helped. I\xe2\x80\x99ve had phone to Apple n Knoxville T\xe2\x80\xa6 https://t.co/DKFwpzVt0h',spoke with every know helped phone Apple Knoxville https DKFwpzVt,0,0,,0,,,
06-03-2020 21:55,b'That doesn\xe2\x80\x99t mean a thing. I have the worst phone I\xe2\x80\x99ve ever had &amp; I\xe2\x80\x99ve had iPhones since the 1st 1 came out &amp; they\xe2\x80\x99\xe2\x80\xa6 https://t.co/pBGCQ3Yu6Z',That doesn mean thing have worst phone ever iPhones since came they https pBGCQ,0,0,,0,,,
06-03-2020 20:48,"b""OVERTIME ALERT: NCAA Women's Basketball (I) - UNC-Greensboro and Mercer are tied up at 67 about to begin Overtime a\xe2\x80\xa6 https://t.co/4XOEbmxnLM""",OVERTIME ALERT NCAA Women Basketball Greensboro Mercer tied about begin Overtime https XOEbmxnLM,0,0.1,,0,,,
02-04-2020 13:58,b'U.S. Cellular is ... taking out Twitter ads to bash Instacart for misclassifying its workers?\n\nWe live in strange t\xe2\x80\xa6 https://t.co/3qPBjQfxW8',Cellular taking Twitter bash Instacart misclassifying workers live strange https qPBjQfxW,0,0,,0,,,
02-04-2020 10:58,"b""@DoctorPaully But u can catch a virus, it's the same as other communicable diseases. A disease causing microorganis\xe2\x80\xa6 https://t.co/2YvSIgmqUo""",catch virus same other communicable diseases disease causing microorganis https YvSIgmqUo,0,0.1,,0,,,
02-04-2020 10:37,b'RT @NascarPaint: David Mayhew - Rheem / Menards (Chevrolet)\n\n2011 U.S. Cellular 250 (Iowa Speedway) #NASCAR https://t.co/yl1xGHLOsU',David Mayhew Rheem Menards Chevrolet Cellular Iowa Speedway NASCAR https xGHLOsU,0,0.1,,0,,,
02-04-2020 09:20,b'5G installation nation wide is the activator of this CVirus....watch as NZ has 5G F...k with our health! \xf0\x9f\x98\xb6 Starving\xe2\x80\xa6 https://t.co/FjqJUT6J3F',installation nation wide activator this CVirus watch with health Starving https FjqJUT,0,0,,0,,,
02-04-2020 05:03,b'RT @ypakora: med school questions should be like \xe2\x80\x9chow do u want to die and explain the pathophysiology behind said mechanism of death inclu\xe2\x80\xa6',school questions should like chow want explain pathophysiology behind said mechanism death inclu,0,0.1,,0,,,
02-04-2020 04:25,b'RT @NascarPaint: David Mayhew - Rheem / Menards (Chevrolet)\n\n2011 U.S. Cellular 250 (Iowa Speedway) #NASCAR https://t.co/yl1xGHLOsU',David Mayhew Rheem Menards Chevrolet Cellular Iowa Speedway NASCAR https xGHLOsU,0,0.1,,0,,,
02-04-2020 04:04,b'@scottmerkin Wasn\xe2\x80\x99t that game played at U.S. Cellular Field?',Wasn that game played Cellular Field,0,0.1,,0,,,
